{
  "$schema": "https://json-schema.org/draft/2020-12/schema",
  "$id": "https://cent-ans.game/schemas/landmark.schema.json",
  "title": "Ville emblématique",
  "description": "Fichier data/landmarks/<id>.json (lot L1) : plan d'une ville emblématique (Paris, Londres…) rendue par une maquette dédiée au lieu de la maquette générique de sa colonie. Coordonnées locales en mètres réels : x vers l'est, y vers le nord (nord vrai), origine = `anchor.lonlat`. Le générateur Blender (`tools/blender_scripts/landmark_city.py`) déforme ce plan par une loupe radiale (`scale`) pour exagérer le centre, pose les monuments à leur propre échelle et remplit les quartiers de maisons. Rendu seulement : aucune règle de jeu.",
  "type": "object",
  "properties": {
    "id": { "$ref": "common.schema.json#/$defs/snake_id" },
    "name": { "type": "string", "minLength": 1 },
    "settlement": { "description": "Colonie dont la maquette est remplacée.", "$ref": "common.schema.json#/$defs/settlement_id" },
    "period": { "type": "string", "description": "État représenté, en français (ex. « vers 1340-1380 »)." },
    "province": { "type": "string", "pattern": "^prov_[a-z0-9_]+$", "description": "Province de la colonie (bataille de siège : la toile de fond s'affiche quand le siège a lieu dans cette province)." },
    "siege": {
      "type": "object",
      "description": "Toile de fond des batailles de siège (échelle réelle, en mètres) : la ville assiégée de la simulation reste générique, le plan est posé derrière elle, fleuve et rive opposée compris.",
      "properties": {
        "rotate_deg": { "type": "number", "description": "Rotation antihoraire du plan pour que le fleuve longe le fond du champ de bataille." },
        "radius_m": { "type": "number", "exclusiveMinimum": 0, "description": "Rayon du plan retenu autour de l'origine." },
        "bank_offset_m": { "type": "number", "description": "Distance de l'origine (après rotation) à la berge proche : la berge est posée au fond du champ." },
        "areas": { "type": "array", "items": { "type": "string" } },
        "monuments": { "type": "array", "items": { "type": "string" } },
        "bridges": { "type": "array", "items": { "type": "string" } },
        "streets": { "type": "array", "items": { "type": "string" } },
        "walls": { "type": "array", "items": { "type": "string" } },
        "cut_m": { "type": "number", "description": "Lot L3 : rien n'est gardé à plus de `cut_m` en avant de l'origine après rotation (négatif : au-delà de l'origine), pour que rien de la toile de fond ne passe sous la ville assiégée." },
        "center_x_m": { "type": "number", "description": "Lot L3 : abscisse (après rotation) du point du plan posé face au centre de la ville assiégée (défaut 0, l'origine)." },
        "battle": {
          "type": "object",
          "description": "Lot L3 (ADR 0026) : la ville assiégée de la bataille est tirée du plan. Le cœur enchaîne les enceintes listées en un anneau (fermé par un quai droit s'il reste ouvert, côté fleuve), le ramène à l'échelle du champ de bataille, tourne la porte attaquée face à l'assaillant ; les autres portes deviennent des châtelets, les rues listées restent libres de maisons.",
          "properties": {
            "walls": { "type": "array", "minItems": 1, "items": { "type": "string" }, "description": "Enceintes (identifiants de `walls`), dans l'ordre où elles s'enchaînent." },
            "gate": { "type": "string", "description": "Nom de la porte attaquée (une des `gates` des enceintes)." },
            "streets": { "type": "array", "items": { "type": "string" }, "description": "Rues (identifiants de `streets`) gardées comme voies dans la ville assiégée." },
            "square": { "$ref": "#/$defs/point", "description": "Place centrale que l'assaillant doit tenir (défaut : centre de l'anneau)." },
            "radius_m": { "type": "number", "exclusiveMinimum": 0, "description": "Rayon moyen de l'anneau sur le champ de bataille (défaut : celui de la ville générique)." }
          },
          "required": ["walls", "gate"],
          "additionalProperties": false
        }
      },
      "required": ["rotate_deg", "radius_m", "bank_offset_m", "areas", "monuments"],
      "additionalProperties": false
    },
    "materials": {
      "type": "object",
      "description": "Lot L3 : matériaux de la ville (atlas partagé). `houses` : tirage pondéré des murs et des toits des maisons ; `palette` : couleurs (RVB linéaire) propres à la ville (calcaire blond de Paris, pierre de Caen, pierre du palais des Papes, brique de Bruges).",
      "properties": {
        "houses": {
          "type": "object",
          "properties": {
            "walls": { "type": "object", "additionalProperties": { "type": "number", "minimum": 0 } },
            "roofs": { "type": "object", "additionalProperties": { "type": "number", "minimum": 0 } }
          },
          "additionalProperties": false
        },
        "palette": {
          "type": "object",
          "additionalProperties": { "$ref": "common.schema.json#/$defs/rgb3" }
        }
      },
      "additionalProperties": false
    },
    "sources": {
      "type": "array",
      "minItems": 1,
      "items": {
        "type": "object",
        "properties": {
          "title": { "type": "string" },
          "author": { "type": "string" },
          "date": { "type": "string" },
          "url": { "type": "string", "format": "uri" },
          "license": { "type": "string" },
          "use": { "type": "string", "description": "Ce que la source a servi à placer." }
        },
        "required": ["title", "license"],
        "additionalProperties": false
      }
    },
    "anchor": {
      "type": "object",
      "description": "Origine du plan sur la carte.",
      "properties": {
        "lonlat": { "$ref": "#/$defs/lonlat" },
        "px": { "$ref": "#/$defs/point", "description": "Même point en pixels carte (EPSG:3035, calculé par l'outil géo et vérifié par test)." },
        "north_bearing_deg": { "type": "number", "minimum": -30, "maximum": 30, "description": "Angle horaire du nord vrai par rapport au haut de la carte (convergence du méridien en EPSG:3035)." }
      },
      "required": ["lonlat", "px", "north_bearing_deg"],
      "additionalProperties": false
    },
    "scale": {
      "type": "object",
      "description": "Loupe radiale : r_monde = A·r + B·r² jusqu'à `core_radius_m` (A = 1/center_meters_per_unit, B déduit de core_radius_px), puis raccord linéaire jusqu'au bord de la zone réservée où l'échelle redevient celle de la carte (le plan rejoint le fleuve et les routes de la carte).",
      "properties": {
        "center_meters_per_unit": { "type": "number", "exclusiveMinimum": 0 },
        "core_radius_m": { "type": "number", "exclusiveMinimum": 0 },
        "core_radius_px": { "type": "number", "exclusiveMinimum": 0 },
        "zone_radius_px": { "type": "number", "exclusiveMinimum": 0, "description": "Rayon de la zone réservée (pas de fleuve, pont ni végétation génériques) ; reporté dans data/map/river_styles.json (custom_zones) du lot V4." },
        "monument_scale": { "type": "number", "exclusiveMinimum": 0, "description": "Facteur par défaut des monuments par rapport à l'échelle du centre." },
        "house_scale": { "type": "number", "exclusiveMinimum": 0 },
        "height_scale": { "type": "number", "exclusiveMinimum": 0, "description": "Facteur vertical supplémentaire (bâtiments)." }
      },
      "required": ["center_meters_per_unit", "core_radius_m", "core_radius_px", "zone_radius_px", "monument_scale", "house_scale", "height_scale"],
      "additionalProperties": false
    },
    "rivers": {
      "type": "array",
      "items": {
        "type": "object",
        "description": "Axe du fleuve d'amont en aval ; chaque point porte la largeur totale du lit (îles comprises).",
        "properties": {
          "id": { "type": "string" },
          "name": { "type": "string" },
          "points": { "type": "array", "minItems": 2, "items": { "$ref": "#/$defs/point_width" } }
        },
        "required": ["id", "name", "points"],
        "additionalProperties": false
      }
    },
    "islands": { "type": "array", "items": { "$ref": "#/$defs/area" } },
    "waters": {
      "type": "array",
      "description": "Plans d'eau libres (lot L2) : mer, port, bassin, fossé large, marais ; dessinés en eau, sans maisons.",
      "items": { "$ref": "#/$defs/area" }
    },
    "areas": {
      "type": "array",
      "description": "Quartiers bâtis : densité de maisons (0-1). Un point prend la densité de la première zone qui le contient.",
      "items": { "$ref": "#/$defs/area" }
    },
    "open_spaces": {
      "type": "array",
      "description": "Espaces sans maisons : places, cimetières, jardins, prés.",
      "items": { "$ref": "#/$defs/area" }
    },
    "walls": {
      "type": "array",
      "items": {
        "type": "object",
        "properties": {
          "id": { "type": "string" },
          "name": { "type": "string" },
          "points": { "type": "array", "minItems": 2, "items": { "$ref": "#/$defs/point" } },
          "closed": { "type": "boolean" },
          "height_m": { "type": "number", "exclusiveMinimum": 0 },
          "tower_spacing_m": { "type": "number", "exclusiveMinimum": 0 },
          "tower_shape": { "enum": ["round", "square"] },
          "ditch": { "type": "boolean" },
          "gates": {
            "type": "array",
            "items": {
              "type": "object",
              "properties": { "name": { "type": "string" }, "at": { "$ref": "#/$defs/point" } },
              "required": ["name", "at"],
              "additionalProperties": false
            }
          },
          "from_year": { "type": "integer" },
          "until_year": { "type": "integer" }
        },
        "required": ["id", "name", "points", "height_m"],
        "additionalProperties": false
      }
    },
    "bridges": {
      "type": "array",
      "items": {
        "type": "object",
        "properties": {
          "id": { "type": "string" },
          "name": { "type": "string" },
          "from": { "$ref": "#/$defs/point" },
          "to": { "$ref": "#/$defs/point" },
          "width_m": { "type": "number", "exclusiveMinimum": 0 },
          "inhabited": { "type": "boolean", "description": "Pont bordé de maisons." },
          "material": { "enum": ["stone", "wood"] },
          "arches": { "type": "integer", "minimum": 1, "description": "Nombre d'arches (piles à avant-becs) ; défaut : une pile tous les 0,06 unité." },
          "chapel_at": { "type": "number", "minimum": 0, "maximum": 1, "description": "Chapelle sur une pile (fraction de la longueur depuis `from`) : Saint-Thomas de London Bridge, Saint-Nicolas du pont d'Avignon." },
          "gatehouses_at": { "type": "array", "items": { "type": "number", "minimum": 0, "maximum": 1 }, "description": "Portes fortifiées sur le tablier (fractions de la longueur)." },
          "drawbridge_at": { "type": "number", "minimum": 0, "maximum": 1, "description": "Travée levante (fraction de la longueur)." },
          "from_year": { "type": "integer" },
          "until_year": { "type": "integer" }
        },
        "required": ["id", "name", "from", "to", "width_m"],
        "additionalProperties": false
      }
    },
    "streets": {
      "type": "array",
      "items": {
        "type": "object",
        "properties": {
          "id": { "type": "string" },
          "name": { "type": "string" },
          "points": { "type": "array", "minItems": 2, "items": { "$ref": "#/$defs/point" } },
          "width_m": { "type": "number", "exclusiveMinimum": 0 }
        },
        "required": ["id", "name", "points"],
        "additionalProperties": false
      }
    },
    "monuments": {
      "type": "array",
      "items": {
        "type": "object",
        "properties": {
          "id": { "$ref": "common.schema.json#/$defs/snake_id" },
          "name": { "type": "string" },
          "model": {
            "enum": ["notre_dame", "sainte_chapelle", "palais_cite", "louvre", "chatelet", "bastille", "market_halls", "church", "abbey", "keep", "windmill", "tower", "gothic_cathedral", "castle", "papal_palace", "belfry", "royal_palace", "gate_tower", "cog"],
            "description": "Maillage dédié ou gabarit paramétré du générateur (landmark_monuments.py). Gabarits réutilisables du lot L2 : gothic_cathedral, castle, belfry, royal_palace, gate_tower, cog (navire)."
          },
          "params": {
            "type": "object",
            "description": "Paramètres du gabarit (lot L2), longueurs en mètres réels : voir la docstring du constructeur dans landmark_monuments.py (ex. gothic_cathedral : length_m, spire_m, west_towers ; castle : rings, keep).",
            "additionalProperties": true
          },
          "at": { "$ref": "#/$defs/point" },
          "angle_deg": { "type": "number", "description": "Rotation antihoraire de l'axe +x du modèle depuis l'est (églises : axe vers le chœur)." },
          "scale": { "type": "number", "exclusiveMinimum": 0, "description": "Remplace scale.monument_scale." },
          "size": { "type": "number", "exclusiveMinimum": 0, "description": "Taille relative du gabarit (églises, abbayes)." },
          "clear_radius_m": { "type": "number", "minimum": 0, "description": "Rayon (m, avant loupe × échelle du monument) sans maisons autour." },
          "from_year": { "type": "integer" },
          "until_year": { "type": "integer" },
          "variant_from_year": {
            "type": "object",
            "description": "Variante du modèle à partir d'une année (ex. Louvre de Charles V en 1364).",
            "additionalProperties": { "type": "integer" }
          },
          "description": { "type": "string" }
        },
        "required": ["id", "name", "model", "at"],
        "additionalProperties": false
      }
    }
  },
  "required": ["id", "name", "settlement", "sources", "anchor", "scale", "monuments"],
  "additionalProperties": false,
  "$defs": {
    "lonlat": {
      "type": "array",
      "prefixItems": [
        { "type": "number", "minimum": -25, "maximum": 70 },
        { "type": "number", "minimum": 20, "maximum": 72 }
      ],
      "minItems": 2,
      "maxItems": 2
    },
    "point": { "type": "array", "items": { "type": "number" }, "minItems": 2, "maxItems": 2 },
    "point_width": { "description": "[x, y, largeur m]", "$ref": "common.schema.json#/$defs/vec3" },
    "area": {
      "type": "object",
      "properties": {
        "id": { "type": "string" },
        "name": { "type": "string" },
        "kind": { "enum": ["built", "island", "square", "cemetery", "garden", "meadow", "parvis", "vineyard", "water", "harbour", "sea", "marsh", "hill"] },
        "polygon": { "type": "array", "minItems": 3, "items": { "$ref": "#/$defs/point" } },
        "density": { "type": "number", "minimum": 0, "maximum": 1 },
        "from_year": { "type": "integer" },
        "until_year": { "type": "integer" }
      },
      "required": ["id", "name", "polygon"],
      "additionalProperties": false
    }
  }
}
